,Unnamed: 0,1,X,2,1or2,Xor2,1orX
0,Aston Villa vs Newcastle United,3.6,3.45,2.15,1.33,3.50,1.47
1,Tottenham Hotspur vs Bournemouth,4.7,7.0,1.23,4.50,2.65,3.45
2,Chelsea vs Brighton and Hove Albion,2.7,1.3,3.65,2.50,3.30,3.0
3,Wolverhampton Wanderers vs Brentford,1.42,3.05,2.1,3.45,3.75,1.42
4,Everton vs Fulham,3.05,2.85,3.25,2.65,1.43,2.95
5,Southampton vs Crystal Palace,1.16,8.5,19.0,1.10,8.00,5.9
6,Manchester City vs Leicester City,4.4,1.58,1.27,4.10,4.90,4.1
7,West Ham United vs Arsenal,1.7,1.25,4.2,4.40,4.20,1.75
8,Nottingham Forest vs Manchester United,1.18,5.1,1.2,6.80,14.50,1.15
9,Leeds United vs Liverpool,5.6,2.5,3.45,2.80,1.32,3.5
10,Arsenal vs Southampton,2.35,3.4,3.05,1.35,3.30,1.25
11,Fulham vs Leeds United,6.2,12.5,1.15,5.60,2.15,3.25
12,Brentford vs Aston Villa,3.7,1.47,2.75,2.50,3.35,2.85
13,Liverpool vs Nottingham Forest,1.38,3.1,1.9,3.70,4.10,1.3
14,Crystal Palace vs Everton,3.6,3.1,3.35,2.35,1.35,3.3
15,Leicester City vs Wolverhampton Wanderers,2.25,3.4,3.3,1.40,3.05,2.3
16,Newcastle United vs Tottenham Hotspur,3.8,2.85,1.23,4.40,1.75,4.1
17,Bournemouth vs West Ham United,4.5,1.23,4.4,1.65,4.20,4.9
18,Wolverhampton Wanderers vs Crystal Palace,1.23,4.3,2.25,3.10,3.75,1.48
19,Leeds United vs Leicester City,2.75,1.43,4.9,7.50,1.20,4.9
20,Aston Villa vs Fulham,2.3,3.25,3.45,1.48,2.75,
21,Manchester City vs Arsenal,1.85,3.6,4.6,1.38,3.20,
22,Rayo Vallecano vs Osasuna,6.0,4.3,1.58,1.25,4.20,
23,Villarreal CF vs Real Valladolid CF,1.55,4.4,6.4,1.27,3.95,
24,Athletic Club Bilbao vs Real Sociedad,6.3,3.95,1.6,1.42,3.00,
25,Real Betis vs Espanyol,1.23,6.5,13.5,1.18,5.20,
26,Cadiz vs Real Madrid,2.15,3.35,3.65,1.45,2.90,
27,Girona vs Elche CF,1.8,3.35,5.3,1.55,2.50,
28,Getafe vs Barcelona,2.05,3.4,3.85,1.45,2.85,
29,Atletico Madrid vs Almeria,2.8,3.25,2.7,1.45,2.85,
30,Valencia vs Sevilla,3.85,3.75,1.95,1.30,3.60,
31,Celta Vigo vs Mallorca,1.7,3.7,5.6,1.43,2.90,
32,Espanyol vs Cadiz,2.35,3.5,3.0,1.32,3.55,
33,Osasuna vs Real Betis,1.4,5.2,7.5,1.18,4.90,
34,Almeria vs Athletic Club Bilbao,4.1,3.5,1.95,1.38,3.10,
35,Real Sociedad vs Rayo Vallecano,1.95,3.6,4.0,1.33,3.35,
36,Real Valladolid CF vs Girona,2.15,2.95,4.3,1.75,2.10,
37,Real Madrid vs Celta Vigo,3.45,3.5,2.15,1.33,3.35,
38,Elche CF vs Valencia,2.5,3.3,2.95,1.35,3.35,
39,Barcelona vs Atletico Madrid,5.3,3.7,1.75,1.38,3.20,
40,Mallorca vs Getafe,3.1,3.25,2.45,1.45,2.90,
41,Sevilla vs Villarreal CF,1.55,4.2,6.7,1.32,3.55,
42,Cremonese vs Empoli,1.45,4.6,7.8,1.27,4.10,
43,Spezia vs Lazio,2.0,3.35,4.4,1.48,2.80,
44,Bologna vs AC Milan,1.75,3.7,5.4,1.43,2.95,
45,Napoli vs Hellas Verona FC,3.65,3.55,2.1,1.35,3.40,
46,FC Internazionale vs AC Monza Brianza 1912,1.9,3.5,4.5,1.43,2.95,
47,Lecce vs Sampdoria,2.4,3.5,2.95,1.28,3.75,
48,Torino vs Salernitana,2.8,3.1,2.7,1.50,2.65,
49,Sassuolo vs Juventus,3.0,3.5,2.35,1.28,3.75,
50,AS Roma vs Udinese,1.9,3.35,4.6,1.48,2.70,
51,Fiorentina vs Atalanta BC,2.5,3.3,2.95,1.35,3.25,
52,Hellas Verona FC vs Bologna,5.7,4.2,1.58,1.25,4.10,
53,Salernitana vs Sassuolo,3.7,3.55,2.05,1.33,3.45,
54,Lazio vs Torino,1.65,4.0,5.5,1.25,4.00,
55,Sampdoria vs Spezia,1.52,4.2,6.7,1.33,3.45,
56,Empoli vs FC Internazionale,2.95,3.25,2.55,1.38,3.10,
57,AC Monza Brianza 1912 vs Fiorentina,2.3,3.4,3.2,1.33,3.35,
58,Udinese vs Cremonese,2.4,3.35,3.15,1.38,3.20,
59,AC Milan vs Lecce,2.6,3.45,2.8,1.33,3.45,
60,Juventus vs Napoli,1.22,7.8,13.0,1.07,10.50,
61,Atalanta BC vs AS Roma,1.25,6.7,12.0,1.14,6.30,
62,Schalke 04 vs Hertha Berlin,3.5,3.85,2.05,1.22,4.60,
63,FC Koln vs Mainz 05,1.75,4.2,4.5,1.22,4.70,
64,Bayern Munich vs Hoffenheim,2.7,3.6,2.55,1.28,3.90,
65,RB Leipzig vs Augsburg,1.6,4.0,6.1,1.37,3.25,
66,Stuttgart vs Borussia Dortmund,2.75,3.65,2.5,1.25,4.40,
67,Eintracht Frankfurt vs Borussia Monchengladbach,2.95,3.65,2.3,1.28,3.80,
68,Werder Bremen vs Freiburg,5.7,4.8,1.52,1.16,5.60,
69,Union Berlin vs Bochum,2.2,3.7,3.1,1.27,3.95,
70,Wolfsburg vs Bayer Leverkusen,2.3,3.65,2.95,1.25,4.10,
71,Augsburg vs Stuttgart,3.5,3.75,2.05,1.28,3.80,
72,Mainz 05 vs Bayern Munich,1.7,4.2,4.8,1.20,4.70,
73,Hertha Berlin vs Werder Bremen,1.7,3.85,4.9,1.32,3.50,
74,Hoffenheim vs FC Koln,2.6,3.7,2.55,1.23,4.30,
75,Bochum vs Wolfsburg,2.35,3.4,3.05,1.35,3.30,
76,Borussia Dortmund vs Eintracht Frankfurt,3.5,3.85,2.05,1.18,5.10,
77,Freiburg vs Schalke 04,2.25,3.65,3.2,1.28,3.95,
78,Bayer Leverkusen vs RB Leipzig,1.65,4.5,4.7,1.18,5.20,
79,Borussia Monchengladbach vs Union Berlin,1.52,4.7,6.2,1.20,5.00,
80,Toulouse FC vs Lyon,3.1,3.4,2.4,1.40,3.10,
81,Rennes vs Reims,1.8,3.8,4.5,1.30,3.70,
82,Paris Saint Germain vs Lens,1.8,3.5,5.3,1.48,2.75,
83,Lille vs Montpellier HSC,2.5,3.2,3.1,1.47,2.80,
84,Brest vs Nice,1.4,5.3,7.8,1.14,6.10,
85,Clermont vs Angers SCO,1.22,6.9,14.5,1.15,6.10,
86,Strasbourg vs AC Ajaccio,1.85,4.0,3.85,1.17,5.00,
87,Auxerre vs Nantes,7.8,5.2,1.32,1.14,4.90,
88,AS Monaco vs Lorient,1.3,5.5,8.0,-,-,
89,Marseille vs Troyes AC,6.1,4.2,1.48,-,-,
90,Newcastle Jets vs Macarthur FC,1.52,4.1,5.8,-,-,
91,Shimshon Tel Aviv vs Hapoel Kfar Shalem,2.15,3.7,2.95,1.14,4.90,
92,Gyeongju Women vs Changnyeong Women,3.5,3.85,1.85,1.12,5.20,
93,Hwacheon KSPO vs Incheon (Women),1.18,7.5,11.5,1.06,7.50,
94,FC Seoul Women vs Busan Sangmu (Women),2.4,3.6,2.6,1.14,4.90,
95,Green Gully vs Hume City FC,2.45,3.5,2.6,1.20,3.95,
96,Valentine Phoenix vs Newcastle Olympic,1.95,3.25,3.95,1.42,2.65,
97,Broadmeadow Magic FC vs New Lambton,5.3,4.1,1.55,1.20,4.10,
98,Glenorchy Knights FC vs South Hobart,2.5,3.9,2.35,1.12,5.20,
99,Altona Magic vs St Albans Saints,2.5,3.05,2.85,1.45,2.55,
100,FC Lokomotiv Sofia 1929 vs Pirin Blagoevgrad,2.5,3.3,2.7,1.30,3.15,
101,Shimson Kfar Qasim vs Maccabi Herzliya,2.15,3.25,3.3,1.38,2.80,
102,Khan Tengri vs Kairat Academy,2.7,3.55,2.4,1.27,3.45,
103,Inhulets Petrove vs Kolos Kovalivka,2.2,3.4,3.05,1.30,3.20,
104,Hapoel Marmorek Ironi Rehovot vs Maccabi Yavne,5.1,4.3,1.55,1.18,4.20,
105,Maccabi Shaarayim vs Maccabi Ashdod,2.75,2.8,2.8,1.40,2.75,
106,MS Hulon Yaniv vs Beitar Tel Aviv Ramla,2.9,3.6,2.2,1.23,3.75,
107,Hapoel Herzliya vs Hapoel Bikat Hayarden,1.7,3.9,4.4,1.27,3.45,
108,MS Ironi Kuseife vs Bnei Eilat,2.2,4.0,2.7,-,-,
109,MS Tzeirey Taybe vs MS Tira,1.7,3.4,5.2,-,-,
110,Ironi Nesher vs Hapoel Qalansawe,1.85,3.65,3.75,1.23,3.75,
111,MS Tzeirey Kfar Kana vs Maccabi Nujeidat,7.5,4.1,1.42,1.32,3.10,
112,Watford U21 vs Ipswich U21,6.2,3.9,1.5,1.33,3.00,
113,Etar Veliko Tarnovo vs Minyor Pernik,1.52,3.95,6.1,1.28,3.35,
114,Hapoel Baka El Garbiya vs Maccabi Kiryat Ata Bialik,2.1,3.35,3.3,1.28,3.25,
115,FC Rukh Vynnyky vs Dinamo Kiev,3.0,3.1,2.4,1.37,2.85,
116,FC Septemvri (Sofia) vs FC CSKA 1948,1.38,4.6,7.5,1.23,3.75,
117,Hapoel Petach Tikva vs Hapoel Akko,1.58,4.8,4.3,-,-,
118,Bnei Yehuda Tel Aviv vs Maccabi Kabilio Jaffa,1.25,5.5,11.5,-,-,
119,Irony Tiberias vs Maccabi Petach Tikva,1.16,8.2,11.5,-,-,
120,Zrinjski Mostar vs Zeljeznicar,2.3,3.25,3.0,1.32,3.10,
121,Hull City U21 vs Colchester U21,2.35,3.15,3.05,1.33,3.05,
122,Navbahor Namangan vs FK Andijan,2.35,3.2,2.95,1.30,3.20,
123,FC Kobenhavn U19 vs AGF U19,1.7,3.5,4.9,1.38,2.80,
124,Maccabi Ahi-Nazrat vs Hapoel Ramat Gan,4.1,3.35,1.9,1.35,2.95,
125,Hapoel Rishon Lezion vs Hapoel Afula,2.25,3.35,3.05,1.30,3.25,
126,Hapoel Nir Ramat HaSharon vs Hapoel Nof Hagalil,2.75,3.05,2.6,1.47,2.50,
127,Zira IK vs Sabail FC,1.13,8.5,15.0,1.09,5.50,
128,Kustosija vs Rudes,1.45,4.0,7.5,1.40,2.70,
129,Metalurgs Liepaja vs FK Auda,1.8,3.4,4.4,-,-,
130,FK Tuzla City vs FK Velez Mostar,2.15,3.2,3.4,-,-,
131,Johor Darul Takzim vs PDRM,3.5,3.2,2.1,-,-,
132,Montana vs Litex Lovech,1.25,5.9,9.8,1.15,4.70,
133,Dobrudzha vs FC Sozopol,2.25,3.35,3.05,1.30,3.20,
134,FC Vitosha (Bistritza) vs Spartak Pleven,2.4,3.1,2.95,1.40,2.75,
135,Botev Plovdiv II vs Dunav Ruse,2.05,3.4,3.3,1.30,3.25,
136,Kuala Lumpur vs Imigresen,2.15,3.2,3.3,1.42,2.65,
137,FK Humenne vs MSK Zilina II,5.9,4.1,1.5,1.25,3.60,
138,FK Suduva vs Banga Gargzdai,1.6,4.1,4.9,1.18,4.30,
139,HIFK vs Gnistan,2.2,3.25,3.2,1.33,3.05,
140,FC U Craiova 1948 vs SC FC Voluntari SA,3.95,3.5,1.85,1.30,3.20,
141,FK Arda Kardzhali vs Ludogorets 1947,1.45,4.4,6.4,1.22,3.80,
142,Marila Pribram vs SK Slavia Praha II,3.25,3.6,2.05,1.20,3.90,
143,FC Haka vs AC Oulu,1.09,10.0,24.0,1.08,5.90,
144,KTP vs KuPS,2.75,3.15,2.55,1.40,2.75,
145,Dunajska Streda vs Podbrezova,2.65,3.05,2.65,1.43,2.60,
146,SJK Akatemia vs Jaro,2.8,3.15,2.5,1.38,2.80,
147,Rigas Futbola Skola vs FK Tukums 2000/BSS,1.95,3.5,3.65,1.28,3.35,
148,Marsaxlokk FC vs Floriana,2.05,3.15,4.0,1.50,2.55,
149,Vysocina Jihlava vs SK Lisen,1.52,4.1,5.5,1.22,3.85,
150,HNK Sibenik vs HNK Gorica (Croatia),6.7,3.3,1.6,1.60,2.20,
151,CWKS Resovia Rzeszow vs MZKS Chrobry Glogow,7.5,5.2,1.33,1.14,4.90,
152,Warta Poznan vs Slask Wroclaw,1.95,3.6,3.45,1.20,4.00,
153,PFC Neftchi vs FK Qabala,2.4,3.45,2.7,1.20,3.95,
154,Mes Kerman vs Persepolis,1.75,3.9,4.1,1.18,4.20,
155,Djurgardens IF Women vs Rosengard (Women),6.1,4.6,1.43,1.13,5.10,
156,FK Pohronie vs FK Puchov,1.95,3.6,3.45,1.22,3.80,
157,SK Vorwaerts Steyr vs Amstetten,4.3,4.2,1.65,1.12,5.30,
158,FC Admira Wacker Modling vs KSV Superfund,3.95,2.8,2.15,1.58,2.25,
159,FC Liefering vs BW Linz,2.25,3.6,2.85,1.20,4.10,
160,Licht Loidl Lafnitz vs Rapid Vienna II,2.5,3.75,2.45,1.13,5.20,
161,Herstedoster vs Roskilde KFUM BK,1.7,3.8,4.8,1.27,3.75,
162,Naft Masjed Soleyman vs Zob Ahan,3.25,3.4,2.2,1.28,3.55,
163,Avarta vs Holbaek,2.5,3.3,2.95,1.35,3.35,
164,Herlev vs Slagelse B&I,1.85,3.4,4.1,1.37,2.90,
165,Greuther Furth vs Jahn Regensburg,2.7,2.5,3.25,1.80,1.90,
166,Hannover 96 vs FC Heidenheim,2.6,3.1,2.7,1.40,2.75,
167,Cremonese vs Empoli,2.05,3.45,3.3,1.25,3.60,
168,FCM Traiskirchen vs SV Leobendorf,1.9,3.7,3.6,1.20,4.00,
169,Nassaji Mazandaran vs Aluminium Arak,1.7,3.9,4.8,1.23,4.10,
170,Deportes Recoleta vs Deportes Iquique,2.3,3.55,2.8,1.20,4.10,
171,Helsingor vs Naestved,3.15,3.35,2.2,1.30,3.20,
172,SonderjyskE vs Vendsyssel FF,1.16,7.2,16.0,1.10,5.40,
173,FC Midtjylland vs AaB,1.43,4.7,6.1,1.10,5.70,
174,Saarbrucken vs Dynamo Dresden,1.23,6.4,10.0,1.08,6.60,
175,UD Oliveirense vs Farense,3.55,3.9,1.85,1.13,5.00,
176,Birkirkara vs Pieta Hotspurs,2.45,3.85,2.45,1.11,5.50,
177,Hassleholms IF vs IFK Malmo,1.55,4.2,5.2,1.20,3.95,
178,LASK Linz (Am) vs USV St. Anna am Aigen,1.7,3.95,4.1,1.17,4.40,
179,Kvarnsvedens vs Sandvikens AIK FK,1.13,7.8,19.0,1.10,5.40,
180,IFK Skovde vs Lidkopings,3.1,3.8,2.05,1.16,4.50,
181,WSC Hertha Wels vs SV Neuhofen/SV Ried II,1.3,5.5,8.0,1.13,5.20,
182,SC Weiz vs Union Vocklamarkt,1.9,3.75,3.5,1.17,4.40,
183,DSV Leoben vs Allerheiligen,3.6,3.85,1.85,1.17,4.30,
184,ASV Drassburg vs SR Donaufeld,1.85,3.9,3.55,1.13,5.10,
185,Sparkasse Gleisdorf vs SAK Klagenfurt,2.05,3.75,3.05,1.17,4.40,
186,SC Neusiedl am See vs ASV Siegendorf,1.85,3.7,3.7,1.18,4.20,
187,Gorslev vs Karlslunde IF,2.7,3.45,2.55,1.25,3.90,
188,SC Krems vs FC Mauerwerk,1.85,3.45,3.95,1.30,3.20,
189,Wiener SK vs FC Marchfeld Grossenzersdorf,2.45,3.15,2.85,1.40,2.70,
190,Karlskrona vs IFK Hassleholm,2.15,3.3,3.25,1.35,2.95,
191,SV Ried vs WSG Wattens,1.52,3.8,6.2,1.37,2.85,
192,USL Dunkerque vs US Avranches,3.45,3.25,2.1,1.40,2.75,
193,Cholet SO vs St Brieuc Stade,2.25,3.15,3.15,1.35,2.90,
194,Bourg-Peronnas vs Le Puy,2.0,3.35,3.65,1.30,3.20,
195,Concarneau vs Paris 13 Atletico,2.7,3.45,2.4,1.17,4.40,
196,FC Bastia-Borgo vs CS Sedan Ardennes,2.85,3.5,2.25,1.18,4.20,
197,Le Mans vs Chateauroux,1.3,5.9,8.8,1.10,6.70,
198,Versailles vs Villefranche,1.9,3.75,3.8,1.23,4.20,
199,Schaffhausen vs Yverdon,3.2,3.55,2.15,1.25,4.00,
200,Neuchatel Xamax vs FC Wil,2.75,3.3,2.45,1.27,3.45,
201,Galatasaray vs Kayserispor,2.2,3.4,3.0,1.25,3.60,
202,Antalyaspor vs Alanyaspor,1.43,4.6,6.3,1.15,4.70,
203,Excelsior vs Go Ahead Eagles,3.6,3.5,1.95,1.25,3.65,
204,DEAC vs Puskas FC Academy,1.65,4.1,4.4,1.11,5.50,
205,VVV Venlo vs FC Eindhoven,2.85,3.45,2.3,1.23,3.75,
206,Heracles Almelo vs Roda JC,5.5,4.2,1.52,1.17,4.40,
207,NAC Breda vs Willem II,1.2,6.4,12.5,1.09,6.10,
208,Maastricht vs Dordrecht,1.48,4.5,5.5,1.13,5.00,
209,Den Bosch vs Helmond Sport,2.55,3.35,2.6,1.23,3.70,
210,TOP Oss vs De Graafschap,1.95,3.15,3.95,1.45,2.55,
211,FC Zwolle vs Telstar,3.1,3.8,2.05,1.16,4.50,
212,KFCO Beerschot-Wilrijk vs Club NXT,1.6,4.1,4.8,1.12,5.20,
213,Lommel United vs Deinze,1.47,4.8,5.4,-,-,
214,ACS UTA Batrana Doamna vs Botosani,1.16,7.8,12.5,-,-,
215,Ajman vs Sharjah FC,2.3,3.65,2.7,-,-,
216,Al Ain (UAE) vs Al Wasl Sports Club (UAE),1.95,3.45,3.7,1.30,3.20,
217,Southampton U21 vs Stoke U21,1.7,4.0,4.1,1.14,5.00,
218,Aston Villa U21 vs Derby U21,2.35,3.35,2.9,1.28,3.35,
219,Arsenal U21 vs Brighton U21,2.45,3.4,2.85,1.28,3.65,
220,FC Koper vs ND Gorica,3.0,3.05,2.5,1.43,2.80,
221,Thun vs Aarau,2.4,3.35,3.15,1.38,3.20,
222,Grazer AK vs St Polten,1.6,4.1,4.9,1.16,4.50,
223,Zaglebie Lubin vs Gornik Zabrze,1.4,4.9,6.1,1.10,5.70,
224,Modena vs Parma FC,5.1,4.2,1.55,1.10,5.90,
225,Schalke 04 vs Hertha Berlin,3.75,3.35,1.95,1.33,3.05,
226,Wisla Krakow vs ZKS Stal Rzeszow,1.33,5.4,7.0,1.12,5.30,
227,White Star Woluwe (W) vs Eendracht Aalst (W),1.7,3.6,4.9,1.33,3.00,
228,KAA Gent (Women) vs Club Brugge KV (Women),1.9,3.35,3.95,1.37,2.85,
229,Gudja Utd vs Valletta,5.3,3.7,1.75,1.38,3.20,
230,Llanelli vs Swansea University FC,2.05,3.6,3.45,1.23,4.10,
231,Al Muharraq Sports Club vs East Riffa,3.25,3.45,2.2,1.33,3.30,
232,Al Ahli Manama vs Al Bahrain SC,2.85,3.1,2.45,1.40,2.70,
233,Spezia vs Lazio,4.6,3.45,1.75,1.37,2.85,
234,Standard Liege vs Charleroi,1.55,3.7,6.3,1.38,2.80,
235,Ross County vs Aberdeen,1.38,4.6,7.5,1.23,3.75,
236,Crusaders vs Larne,2.35,3.45,2.75,1.22,3.80,
237,Univ. College Dublin vs Cork City,1.06,12.0,35.0,1.07,6.30,
238,Shamrock Rovers vs Shelbourne,9.0,5.4,1.28,1.15,4.70,
239,Galway FC vs Bray Wanderers,1.52,4.2,5.5,1.18,4.30,
240,Athlone vs Cobh Ramblers,2.3,3.25,3.0,1.30,3.20,
241,Waterford vs Kerry,3.75,3.75,1.85,1.18,4.20,
242,Bala Town vs The New Saints,4.9,4.6,1.52,1.09,6.00,
243,Queens Park FC vs Hamilton Academical,24.0,7.8,1.12,1.15,4.40,
244,Bohemians FC vs St Patrick's Athletic FC,2.45,3.15,2.85,1.35,3.00,
245,Al Sailiya vs Al Rayyan SC (QAT),6.7,4.9,1.38,1.12,5.30,
246,Al Gharafa vs Al Duhail SC (QAT),1.95,3.65,3.75,1.25,3.90,
247,Airbus UK vs Flint Town United,2.6,3.2,2.65,1.35,2.90,
248,Al Ittifaq Dammam (KSA) vs Al Feiha (KSA),2.75,2.95,2.85,1.58,2.35,
249,Al Baten Club (KSA) vs Al-Hilal (KSA),3.5,3.85,2.05,1.18,5.10,
250,Middlesbrough vs Norwich City,2.25,3.1,3.75,1.48,2.75,
251,Finn Harps vs Treaty United,2.25,3.25,3.6,1.47,2.80,
252,Albacete vs Eibar,1.3,5.0,10.0,1.27,3.40,
253,Toulouse FC vs Lyon,2.6,3.0,2.8,1.40,2.70,
254,Rayo Vallecano vs Osasuna,4.9,3.5,1.7,1.35,2.95,
255,Famalicao vs Guimaraes,1.85,3.35,4.2,1.35,2.95,
256,Al Ahly Cairo vs Pharco FC,2.0,3.55,3.7,1.25,3.85,
257,Al Ittihad (EGY) vs Smouha Sporting Club,2.2,3.0,3.45,1.50,2.45,
258,Aswan FC vs Pyramids FC,1.32,5.5,9.2,1.18,4.80,
259,Atletico Rafaela vs Aldosivi Mar del Plata,2.75,2.9,2.75,1.52,2.35,
260,Palestino vs Cobresal,2.85,2.85,2.65,1.55,2.25,
261,Tigres FC vs Real Santander,2.05,3.35,3.6,1.33,3.30,
262,Sporting Cristal vs Sport Boys Association,2.1,3.05,3.7,1.48,2.45,
263,Mouloudia d'Oujda vs Maghreb Fes,1.75,3.6,4.4,1.30,3.20,
264,DHJ El Jadida vs Olympic Safi,2.4,3.3,3.0,1.32,3.35,
265,CD Nublense vs Coquimbo,2.35,2.95,3.2,1.55,2.25,
266,Guarani SP vs Avai,1.43,4.2,7.2,1.33,3.00,
267,Tepatitlan FC vs Tlaxcala FC,1.7,3.7,4.9,1.33,3.25,
268,Resistencia vs General Caballero,1.95,3.6,3.45,1.20,3.95,
269,Llaneros FC Villavicencio vs Deportes Quindio,2.25,3.2,3.15,1.40,2.75,
270,Nacional (Uru) vs Centro Atletico Fenix,2.15,3.05,3.55,1.45,2.55,
271,Melgar vs Cienciano,1.65,3.75,5.1,1.32,3.10,
272,Oriente Petrolero vs Royal Pari FC,2.65,3.1,2.7,1.42,2.65,
273,Gimnasia Jujuy vs Independiente Rivadavia,1.85,3.6,4.2,1.28,3.55,
274,Patronato Parana vs AA Estudiantes Rio Cuarto,2.25,3.45,2.95,1.28,3.35,
275,Academia Puerto Cabello vs CD Hermanos Colmenarez,2.15,3.35,3.2,1.30,3.20,
276,Ituano (SP) vs Ceara,1.85,3.35,4.3,1.42,2.65,
277,CD Everton Vina del Mar vs Magallanes,2.3,3.1,3.4,1.48,2.60,
278,AD San Carlos vs Sporting San Jose FC,2.05,3.45,3.55,1.28,3.60,
279,Municipal de Perez Zeledon vs AD Santos de Guapiles,3.2,3.5,2.2,1.23,4.20,
280,CA Independiente vs San Francisco FC,2.5,3.35,2.65,1.27,3.45,
281,Alianza Petrolera vs Jaguares de Cordoba,3.4,3.55,2.0,1.28,3.30,
282,Club Necaxa vs Puebla FC,1.16,8.2,11.5,-,-,
283,Mazatlan FC vs Club Tijuana,1.85,3.5,4.0,1.30,3.15,
284,Fukushima United vs Gainare Tottori,13.5,8.0,1.14,1.04,9.50,
285,FC Maruyasu Okazaki vs Honda FC,7.5,5.6,1.3,1.07,6.70,
286,Clarence Zebras vs Launceston Utd,1.38,5.0,6.6,1.09,6.00,
287,Jeonnam Dragons vs Cheongju,4.9,4.0,1.6,1.16,4.60,
288,Lake Macquarie City vs Maitland FC,2.55,3.3,2.8,1.35,3.15,
289,Adamstown Rosebud vs Lambton Jaffas,2.1,3.75,3.0,1.15,4.70,
290,Avondale FC vs Heidelberg United,2.85,3.25,2.4,1.30,3.05,
291,North Geelong Warriors vs Dandenong Thunder,3.35,3.85,1.9,1.13,5.00,
292,Suwon Samsung Bluewings FC vs Jeju United,2.45,3.1,3.1,1.47,2.70,
293,Melbourne City FC (women) vs Melbourne Victory (Women),6.4,4.4,1.48,1.23,4.10,
294,Sagamihara vs Nagano Parceiro,1.58,4.2,4.9,1.16,4.60,
295,Moreland City vs Melbourne Knights,2.35,3.35,3.0,1.38,2.95,
296,Albirex Niigata vs Avispa Fukuoka,3.1,3.75,2.15,1.20,4.50,
297,Yokohama FC vs Hiroshima Sanfrecce FC,2.0,3.65,3.5,1.25,3.95,
298,South Melbourne vs Bentleigh Greens,2.55,3.25,2.8,1.38,3.05,
299,Kawasaki Frontale vs Nagoya Grampus Eight,70.0,15.0,1.03,-,-,
300,Shonan Bellmare vs Yokohama F. Marinos,4.1,4.4,1.65,1.07,6.90,
301,Urawa Red Diamonds vs Consadole Sapporo,2.1,3.8,2.95,1.11,5.40,
302,Sagan Tosu vs Kashiwa Reysol,2.65,3.6,2.35,1.14,4.90,
303,Riverside Olympic FC vs Devonport City,2.55,3.75,2.4,1.13,5.10,
304,Launceston City FC vs Kingborough Lions,2.7,3.1,2.6,1.42,2.65,
305,Olympic Kingsway vs Cockburn City,1.75,3.6,4.4,1.30,3.15,
306,Sorrento FC vs Stirling Lions,2.55,3.85,2.35,1.11,5.50,
307,Perth SC vs Floreat Athena,2.3,3.85,2.65,1.11,5.60,
308,Chungnam Asan FC vs Seoul E-land FC,2.8,3.95,2.15,1.10,5.80,
309,Gimcheon Sangmu vs Bucheon FC 1995,2.65,3.25,2.7,1.38,3.00,
310,Armadale SC vs Perth RedStar,2.25,3.3,3.2,1.38,3.05,
311,Inglewood United SC vs Perth Glory Youth,2.8,3.4,2.5,1.33,3.30,
312,Balcatta vs Bayswater City,2.8,3.75,2.3,1.14,5.60,
313,FC Tokyo vs Cerezo Osaka,2.2,3.3,3.35,1.35,3.10,
314,Kashima Antlers vs Vissel Kobe,2.0,3.35,3.65,1.30,3.20,
315,Kyoto Sanga FC vs Gamba Osaka,2.25,3.5,2.9,1.25,3.60,
316,Central Coast Mariners vs Melbourne City,1.7,3.8,4.4,1.23,3.75,
317,Pohang Steelers vs FC Seoul,2.75,3.55,2.35,1.20,3.95,
318,FC Ryukyu vs Giravanz Kitakyushu,2.05,3.75,3.1,1.12,5.40,
319,MFK Chrudim vs Opava,3.2,3.0,2.3,1.52,2.35,
320,Vyskov vs Trinec,2.2,3.35,3.15,1.30,3.20,
321,Sutherland Sharks vs Manly United,4.9,2.15,2.75,2.10,1.58,
322,Marconi Stallions vs Rockdale City Suns,1.32,4.9,14.5,1.65,2.00,
323,CS Mioveni vs Hermannstadt,1.5,3.95,9.0,1.80,1.80,
324,FK Kaspyi Aktau vs FC Okzhetpes,11.5,4.2,1.42,1.70,1.90,
